[
  {
    "as_of_date": "2026-09-25",
    "ticker": "0384.HK",
    "company": "中国燃气 China Gas Holdings Limited",
    "exchange": "HKEX",
    "path": "reports/0384.HK/2026-09-25-中国燃气-China-Gas-0384.HK.html",
    "summary": "观察名单（Watchlist），等待资金证据而非只等降价。参考价5.335港元；已付TTM股息0.50、预扣税后费用前收益率9.37%，最新全年普通股息0.35对应6.56%，不是正常化N。FY2026披露FCF48.38亿港元不等于股东可分派现金；剔除资本回收并扣利息、租赁及少数权益等后，保守全投入现金代理4.24亿，对当期实付股息覆盖0.16倍，非经常性FAD。质量17–44/85、收息9/15，暂定综合26–53/100、等级E–D，证据覆盖80%。母公司资金及再融资链未闭合，暂停买点；不自动交易。",
    "score": "26-53 / E-D (provisional)",
    "portfolio_role": "Watchlist",
    "published_at": "2026-09-25T11:01:29+08:00",
    "ruleset": "2.5",
    "summary_provenance": "repaired_with_evidence",
    "publication_provenance": {
      "kind": "report_metadata",
      "note": "新建单文件HTML；基准日2026-09-25，冻结腾讯10:20:58 HKT延迟盘中报价。生成/归档声明时间不是独立核验的远端推送时刻；保留历史报告，不部署网站。"
    },
    "summary_evidence": [
      {
        "field": "reference_price_hkd",
        "value": "5.335",
        "source_excerpt": "参考价为5.335港元"
      },
      {
        "field": "paid_ttm_dps_hkd",
        "value": "0.50",
        "source_excerpt": "已付TTM现金股息0.50港元"
      },
      {
        "field": "paid_ttm_net_yield_before_fees",
        "value": "9.37%",
        "source_excerpt": "0%发行人预扣情景下费用前收益率9.37%"
      },
      {
        "field": "declared_fiscal_dps_hkd",
        "value": "0.35",
        "source_excerpt": "最新全年普通股息0.35港元对应6.56%"
      },
      {
        "field": "declared_fiscal_net_yield_before_fees",
        "value": "6.56%",
        "source_excerpt": "最新全年普通股息0.35港元对应6.56%"
      },
      {
        "field": "company_reported_fcf_hkd_100m",
        "value": "48.38",
        "source_excerpt": "FY2026的48.38亿港元披露FCF不是利息后、全投入后、可上缴的普通股东FAD。"
      },
      {
        "field": "conservative_all_in_cash_proxy_hkd_100m",
        "value": "4.24",
        "source_excerpt": "FY2026保守全投入现金代理为4.24亿港元，对同年实付普通股息覆盖0.16倍，非经常性FAD。"
      },
      {
        "field": "actual_proxy_coverage",
        "value": "0.16",
        "source_excerpt": "FY2026保守全投入现金代理为4.24亿港元，对同年实付普通股息覆盖0.16倍，非经常性FAD。"
      },
      {
        "field": "quality_score_range",
        "value": "17–44",
        "source_excerpt": "17–44 / 85（暂定）"
      },
      {
        "field": "income_score",
        "value": "9",
        "source_excerpt": "9 / 15（暂定）"
      },
      {
        "field": "combined_score_range",
        "value": "26–53",
        "source_excerpt": "26–53 / 100；等级E–D（暂定）"
      },
      {
        "field": "grade_range",
        "value": "E–D",
        "source_excerpt": "26–53 / 100；等级E–D（暂定）"
      },
      {
        "field": "evidence_coverage_pct",
        "value": "80",
        "source_excerpt": "80/100；质量65/85"
      },
      {
        "field": "portfolio_role",
        "value": "Watchlist",
        "source_excerpt": "最终角色：观察名单（Watchlist）。"
      }
    ]
  },
  {
    "as_of_date": "2026-09-12",
    "ticker": "0101.HK",
    "company": "恒隆地产 Hang Lung Properties Limited",
    "exchange": "HKEX",
    "path": "reports/0101.HK/2026-09-12-恒隆地产-Hang-Lung-Properties-0101.HK.md",
    "summary": "观察名单（Watchlist）：按2026-09-11收盘HK$6.805，已付TTM现金选项DPS0.52、0%预扣情景下费用前收益率7.64%，并非正常化收益。2025全投入后合并现金余额对实际现金股息1.60倍，对同期全现金权益仅0.46倍，两者均非已验证经常性FAD。2026中期0.12将于9月25日全现金支付，截止日已除净、尚未付。租金复苏但上缴、分年投入及未来派息股数链未闭合，质量总分暂不评估，暂停N/B和买入区间，不自动交易。",
    "score": "Not assessed",
    "portfolio_role": "Watchlist",
    "published_at": "2026-09-12T22:15:21+08:00",
    "ruleset": "2.4",
    "summary_provenance": "repaired_with_evidence",
    "publication_provenance": {
      "kind": "report_metadata",
      "note": "新报告信息截止2026-09-12 20:59香港时间，初稿形成于2026-09-12T21:43:36+08:00；2026-09-12T22:15:21+08:00声明归档发布。按用户要求以同一正文生成独立HTML与仓库Markdown；声明时间不是独立验证的远端推送时刻。"
    },
    "summary_evidence": [
      {
        "field": "reference_close_hkd",
        "value": "6.805",
        "source_excerpt": "**按2026-09-11收盘HK$6.805，已付TTM现金选项DPS为0.52港元，0%预扣情景下费用前收益率为7.64%。**"
      },
      {
        "field": "paid_ttm_cash_election_dps_hkd",
        "value": "0.52",
        "source_excerpt": "**按2026-09-11收盘HK$6.805，已付TTM现金选项DPS为0.52港元，0%预扣情景下费用前收益率为7.64%。**"
      },
      {
        "field": "withholding_scenario",
        "value": "0%",
        "source_excerpt": "**按2026-09-11收盘HK$6.805，已付TTM现金选项DPS为0.52港元，0%预扣情景下费用前收益率为7.64%。**"
      },
      {
        "field": "paid_ttm_yield_before_fees",
        "value": "7.64%",
        "source_excerpt": "**按2026-09-11收盘HK$6.805，已付TTM现金选项DPS为0.52港元，0%预扣情景下费用前收益率为7.64%。**"
      },
      {
        "field": "fy2025_actual_cash_budget_ratio_not_fad",
        "value": "1.60",
        "source_excerpt": "| 2025现金覆盖表象 | 全投入后合并现金余额1,165，对实际现金股息727的比值为1.60倍 | 不是经常性FAD；大量股东选择代息股使实际现金分母缩小 |"
      },
      {
        "field": "fy2025_full_cash_entitlement_ratio_not_fad",
        "value": "0.46",
        "source_excerpt": "| 2025全现金权益检验 | 同期付款事件全部现金等值权益2,513.714；比值仅0.46倍 | 若全部现金结算，静态差额为1,348.714；不是已发生的欠付 |"
      },
      {
        "field": "declared_interim_dps_hkd",
        "value": "0.12",
        "source_excerpt": "| 最新已宣布、未支付 | 2026中期0.12；2026-09-25支付 | 全现金；除净2026-08-12，登记2026-08-14 |"
      },
      {
        "field": "portfolio_role",
        "value": "Watchlist",
        "source_excerpt": "**最终角色：观察名单（Watchlist）。**"
      }
    ]
  },
  {
    "as_of_date": "2026-09-12",
    "ticker": "0005.HK",
    "company": "汇丰控股 HSBC Holdings plc",
    "exchange": "HKEX",
    "path": "reports/0005.HK/2026-09-12-汇丰控股-HSBC-Holdings-0005.HK.md",
    "summary": "截至2026-09-12，参考价HKD163.30；已付TTM普通股息HKD5.861530／股，香港个人普通股息0%预扣情景下费用前收益率3.59%。2026第二期USD0.10已宣告未付，不计TTM。2025母公司实收子公司股息USD23.816bn，但未来资本、可上缴现金与正常化N未闭合，暂停N/B及操作价格；质量与兼容总分暂不评估，角色Watchlist。",
    "score": "Not assessed",
    "portfolio_role": "Watchlist",
    "published_at": "2026-09-12T21:01:51+08:00",
    "ruleset": "2.4",
    "summary_provenance": "repaired_with_evidence",
    "supersedes": "reports/0005.HK/2026-07-17-汇丰控股-HSBC-Holdings-0005.HK.md",
    "publication_provenance": {
      "kind": "report_metadata",
      "note": "HTML与Markdown同源生成；该时间为报告生成及归档声明时间，不是独立核验的远端推送时刻。现行归档仅接收Markdown；HTML作为本地离线文件交付，研究截止为2026-09-12 19:56:57香港时间。同日补齐2021/2025自然年已付现金与CPI购买力，补充时间另记于正文，不改变研究截止、原发布时间或估值结论。"
    },
    "summary_evidence": [
      {
        "field": "as_of_date",
        "value": "2026-09-12",
        "source_excerpt": "2026-09-12 19:56:57香港时间；市场收盘采用2026-09-11"
      },
      {
        "field": "reference_price_hkd",
        "value": "163.30",
        "source_excerpt": "按HKD163.30及发行人已付港元金额计算，过去十二个月扣预扣税后、费用前股息率为3.59%。"
      },
      {
        "field": "paid_ttm_ordinary_hkd_per_share",
        "value": "5.861530",
        "source_excerpt": "| 付款口径TTM | USD0.75；HKD5.861530 |"
      },
      {
        "field": "ordinary_dividend_withholding_scenario",
        "value": "0%",
        "source_excerpt": "| 普通股息预扣 | 0%；withholding_basis=legal_structure |"
      },
      {
        "field": "paid_ttm_yield_after_withholding_before_fees",
        "value": "3.59%",
        "source_excerpt": "按HKD163.30及发行人已付港元金额计算，过去十二个月扣预扣税后、费用前股息率为3.59%。"
      },
      {
        "field": "declared_unpaid_ordinary_dps_usd",
        "value": "0.10",
        "source_excerpt": "| 最新已宣告未支付 | USD0.10／股 |"
      },
      {
        "field": "parent_cash_dividends_received_2025_usd_billion",
        "value": "23.816",
        "source_excerpt": "| 2025母公司实收子公司股息 | USD23.816bn |"
      },
      {
        "field": "portfolio_role",
        "value": "Watchlist",
        "source_excerpt": "本次结论为观察（Watchlist）：未来资本、母公司可用现金、正常化及经济汇率桥尚未完整闭合，暂停N/B和操作价格；"
      }
    ]
  },
  {
    "as_of_date": "2026-09-11",
    "ticker": "1919.HK",
    "company": "中远海控 COSCO SHIPPING Holdings",
    "exchange": "HKEX",
    "path": "reports/1919.HK/2026-09-11-中远海控-COSCO-SHIPPING-Holdings-1919.HK.md",
    "summary": "观察名单：参考价HKD16.60，按10%代名人预扣情景，已付TTM净股息率6.06%（费用前，非实际账户确认）。2026中期DPS为RMB0.43，同比下降23.21%。近期需求与运价有韧性，但长期资本支出及子公司上缴现金尚未估定；估值暂停，不提供N/B或买入价，完整评分暂不评估。",
    "score": "Not assessed",
    "portfolio_role": "Watchlist",
    "published_at": "2026-09-11T18:02:35+08:00",
    "ruleset": "2.4",
    "summary_provenance": "repaired_with_evidence",
    "supersedes": "reports/1919.HK/2026-08-14-中远海控-COSCO-SHIPPING-Holdings-1919.HK.md",
    "publication_provenance": {
      "kind": "report_metadata",
      "note": "原报告生成于2026-09-11 14:50+08:00，2026-09-11T18:02:35+08:00声明归档发布；2026-09-12按用户要求转换为Markdown，研究截止仍为2026-09-11 12:44香港时间，原时间与研究结论不变。声明时间不是独立验证的远端推送时刻。"
    },
    "summary_evidence": [
      {
        "field": "reference_price_hkd",
        "value": "16.60",
        "source_excerpt": "| 参考价／行情时间 | HKD 16.60；2026-09-11 12:00香港时间午间分时；腾讯16.600，与Yahoo 11:59分钟收盘对应核对 | 历史时点比较，不是实时交易报价。 |"
      },
      {
        "field": "nominee_withholding_scenario",
        "value": "10%",
        "source_excerpt": "| 过去12个月股息率 | 税前6.74%；预扣后6.06% | 条件性10%预扣情景、费用前；不等于用户券商实际到账收益率。 |"
      },
      {
        "field": "paid_ttm_net_yield_before_fees",
        "value": "6.06%",
        "source_excerpt": "| 过去12个月股息率 | 税前6.74%；预扣后6.06% | 条件性10%预扣情景、费用前；不等于用户券商实际到账收益率。 |"
      },
      {
        "field": "declared_interim_dps_rmb",
        "value": "0.43",
        "source_excerpt": "| 最新已宣布中期息 | 2026年中期每股RMB 0.43，同比下降23.21% | 盈利挂钩的普通现金分红；不把半年DPS乘二当作未来一年预测。 |"
      },
      {
        "field": "interim_dps_decline_pct",
        "value": "23.21%",
        "source_excerpt": "| 最新已宣布中期息 | 2026年中期每股RMB 0.43，同比下降23.21% | 盈利挂钩的普通现金分红；不把半年DPS乘二当作未来一年预测。 |"
      }
    ]
  },
  {
    "as_of_date": "2026-09-11",
    "ticker": "BTI",
    "company": "British American Tobacco p.l.c.（英美烟草）",
    "exchange": "NYSE (ADS)",
    "path": "reports/BTI/2026-09-11-英美烟草-British-American-Tobacco-BTI.md",
    "summary": "按2026-09-10收盘US$54.86及报告统一汇率，公告年度化收益扣已公告ADR存托费后约5.96%，未扣个人券商及换汇成本；不是已核验TTM实收或正常化收益。FY2025公司FCF仅覆盖现金股息0.773倍；加拿大和解付款预计至少40年。经常性FAD、母公司可用现金与未来有权股数证据未闭合，评分暂不评估；角色为观察名单（Watchlist），暂停N/B、买入区间及成长估值，不自动交易。",
    "score": "Not assessed",
    "portfolio_role": "Watchlist",
    "published_at": "2026-09-11T18:03:58+08:00",
    "ruleset": "2.4",
    "summary_provenance": "repaired_with_evidence",